<?xml version="1.0" encoding="UTF-8"?>
<xs:schema xmlns:xs="http://www.w3.org/2001/XMLSchema">

    <xs:element name="Castles">
        <xs:complexType>
            <xs:sequence>
                <xs:element name="Castle" maxOccurs="8">
                    <xs:complexType>
                        <xs:sequence>
                            <xs:element name="Name" type="xs:string"/>
                            <xs:element name="Attack" type="xs:int"/>
                            <xs:element name="Defense" type="xs:int"/>
                            <xs:element name="Benefit" type="xs:string"/>
                        </xs:sequence>
                        <xs:attribute name="id" type="xs:int" use="required"/>
                    </xs:complexType>
                </xs:element>
            </xs:sequence>
        </xs:complexType>
    </xs:element>

</xs:schema>